{
  "format_version": 1,
  "read_only": true,
  "state": "converged",
  "plan_summary": {
    "create": 1,
    "update": 0,
    "delete": 0,
    "noop": 0
  },
  "affected_resources": ["networks"],
  "summary": {
    "converged": 1,
    "drifted": 0,
    "uncertain": 0,
    "unsupported": 0
  },
  "resources": [
    {
      "resource": "networks",
      "state": "converged",
      "declared_count": 1,
      "observed_count": 1,
      "findings": []
    }
  ],
  "recovery": ["The affected resource families match the reviewed plan."]
}
